{
  "ave_id": "AVE-2025-0058",
  "name": "Session State Persistence Attack",
  "aliases": [
    "Zombie Session"
  ],
  "category": "temporal_exploitation",
  "severity": "high",
  "status": "proven",
  "summary": "Injected context persists across session boundaries when session state is not properly cleared.",
  "mechanism": "Incomplete session termination leaves poisoned context accessible to next session. [Available in NAIL SDK]",
  "blast_radius": "Cross-session contamination affecting different users.",
  "prerequisite": "Agent with session persistence and shared state.",
  "environment": {
    "frameworks": [
      "LangGraph",
      "CrewAI"
    ],
    "models_tested": [
      "[Available in NAIL SDK]"
    ],
    "multi_agent": false,
    "tools_required": false,
    "memory_required": true
  },
  "evidence": [
    {
      "experiment_id": "[Available in NAIL SDK]",
      "key_metric": "[Available in NAIL SDK]",
      "key_value": "[Available in NAIL SDK]",
      "data_file": "",
      "p_value": null,
      "sample_size": null,
      "cross_model": false
    }
  ],
  "defences": [],
  "date_discovered": "2026-03",
  "date_published": "",
  "cwe_mapping": "",
  "mitre_mapping": "ATLAS-NOVEL: Session State Persistence Attack",
  "references": [],
  "related_aves": [
    "AVE-2025-0001"
  ],
  "avss_score": {
    "overall_score": 8.1,
    "severity_label": "high",
    "vector_string": "[Available in NAIL SDK]",
    "base_score": null,
    "temporal_score": null,
    "agentic_score": null,
    "vector": null
  },
  "poc": null,
  "timeline": null,
  "_meta": {
    "schema_version": "2.0.0",
    "generated_at": "2026-03-27T22:41:24Z",
    "generator": "NAIL Institute AVE Toolkit",
    "license": "CC-BY-SA-4.0",
    "access_tier": "public",
    "redacted_fields": [
      "avss_score",
      "defences",
      "evidence",
      "mechanism",
      "poc",
      "timeline"
    ],
    "full_access": "https://github.com/NAIL-INSTITUTE-FOR-AGENTIC-SECURITY/ave-database"
  },
  "contributor": "j.okafor"
}