{
  "ave_id": "AVE-2025-0054",
  "name": "Task Decomposition Laundering",
  "aliases": [
    "Subtask Innocence"
  ],
  "category": "multi_agent_collusion",
  "severity": "critical",
  "status": "proven",
  "summary": "Harmful task is decomposed into individually innocuous subtasks distributed across agents, bypassing per-agent safety checks.",
  "mechanism": "Experiment 25 pattern: each agent performs a benign subtask; the aggregate is harmful. [Available in NAIL SDK]",
  "blast_radius": "Complete safety bypass for decomposable harmful tasks.",
  "prerequisite": "Multi-agent pipeline with task distribution.",
  "environment": {
    "frameworks": [
      "LangGraph",
      "CrewAI"
    ],
    "models_tested": [
      "[Available in NAIL SDK]"
    ],
    "multi_agent": true,
    "tools_required": true,
    "memory_required": false
  },
  "evidence": [
    {
      "experiment_id": "[Available in NAIL SDK]",
      "key_metric": "[Available in NAIL SDK]",
      "key_value": "[Available in NAIL SDK]",
      "data_file": "",
      "p_value": null,
      "sample_size": null,
      "cross_model": false
    }
  ],
  "defences": [],
  "date_discovered": "2026-03",
  "date_published": "",
  "cwe_mapping": "",
  "mitre_mapping": "ATLAS-NOVEL: Task Decomposition Laundering",
  "references": [],
  "related_aves": [
    "AVE-2025-0020",
    "AVE-2025-0026"
  ],
  "avss_score": {
    "overall_score": 9.8,
    "severity_label": "critical",
    "vector_string": "[Available in NAIL SDK]",
    "base_score": null,
    "temporal_score": null,
    "agentic_score": null,
    "vector": null
  },
  "poc": null,
  "timeline": null,
  "_meta": {
    "schema_version": "2.0.0",
    "generated_at": "2026-03-27T22:41:24Z",
    "generator": "NAIL Institute AVE Toolkit",
    "license": "CC-BY-SA-4.0",
    "access_tier": "public",
    "redacted_fields": [
      "avss_score",
      "defences",
      "evidence",
      "mechanism",
      "poc",
      "timeline"
    ],
    "full_access": "https://github.com/NAIL-INSTITUTE-FOR-AGENTIC-SECURITY/ave-database"
  },
  "contributor": "dleigh"
}