{
  "ave_id": "AVE-2025-0022",
  "name": "Memory Laundering",
  "aliases": [
    "Provenance Laundering",
    "Self-Citation Trust Escalation"
  ],
  "category": "memory",
  "severity": "high",
  "status": "proven",
  "summary": "Agent stores untrusted information, then retrieves it from its own memory. Because it's now 'self-generated', the trust score is elevated. 53% citation laundering rate.",
  "mechanism": "Round 1: External source \u2192 agent stores fact (low trust). [Available in NAIL SDK]",
  "blast_radius": "Trust model completely undermined. Poisoned facts become 'verified'.",
  "prerequisite": "Agent with persistent memory and self-referential retrieval.",
  "environment": {
    "frameworks": [
      "LangGraph"
    ],
    "models_tested": [
      "[Available in NAIL SDK]"
    ],
    "multi_agent": true,
    "tools_required": false,
    "memory_required": true
  },
  "evidence": [
    {
      "experiment_id": "[Available in NAIL SDK]",
      "key_metric": "citation_laundering_rate",
      "key_value": "[Available in NAIL SDK]",
      "data_file": "",
      "p_value": null,
      "sample_size": null,
      "cross_model": false
    }
  ],
  "defences": [],
  "date_discovered": "2025-03",
  "date_published": "",
  "cwe_mapping": "",
  "mitre_mapping": "",
  "references": [],
  "related_aves": [
    "AVE-2025-0001",
    "AVE-2025-0009"
  ],
  "avss_score": {
    "overall_score": 7.5,
    "severity_label": "high",
    "vector_string": "[Available in NAIL SDK]",
    "base_score": null,
    "temporal_score": null,
    "agentic_score": null,
    "vector": null
  },
  "poc": null,
  "timeline": null,
  "_meta": {
    "schema_version": "1.0.0",
    "generated_at": "2026-03-18T21:02:24Z",
    "generator": "NAIL Institute AVE Toolkit",
    "license": "CC-BY-SA-4.0",
    "access_tier": "public",
    "redacted_fields": [
      "avss_score",
      "defences",
      "evidence",
      "mechanism",
      "poc",
      "timeline"
    ],
    "full_access": "https://github.com/NAIL-INSTITUTE-FOR-AGENTIC-SECURITY/ave-database"
  },
  "contributor": "dleigh"
}