{
  "ave_id": "AVE-2025-0009",
  "name": "Epistemic Contagion",
  "aliases": [
    "Belief Propagation",
    "Misinformation Amplification"
  ],
  "category": "memory",
  "severity": "critical",
  "status": "proven",
  "summary": "False beliefs injected into one agent propagate to all connected agents through conversation. Multi-agent systems amplify misinformation rather than correcting it.",
  "mechanism": "Agent A receives poisoned information. [Available in NAIL SDK]",
  "blast_radius": "100% transmission rate. Entire agent network compromised from single injection.",
  "prerequisite": "Multi-agent system with inter-agent communication.",
  "environment": {
    "frameworks": [
      "LangGraph"
    ],
    "models_tested": [
      "[Available in NAIL SDK]"
    ],
    "multi_agent": true,
    "tools_required": false,
    "memory_required": true
  },
  "evidence": [
    {
      "experiment_id": "[Available in NAIL SDK]",
      "key_metric": "transmission_rate",
      "key_value": "[Available in NAIL SDK]",
      "data_file": "",
      "p_value": null,
      "sample_size": null,
      "cross_model": false
    }
  ],
  "defences": [],
  "date_discovered": "2025-02",
  "date_published": "",
  "cwe_mapping": "",
  "mitre_mapping": "",
  "references": [],
  "related_aves": [
    "AVE-2025-0001",
    "AVE-2025-0022",
    "AVE-2025-0034",
    "AVE-2025-0020"
  ],
  "avss_score": {
    "overall_score": 10.0,
    "severity_label": "critical",
    "vector_string": "[Available in NAIL SDK]",
    "base_score": null,
    "temporal_score": null,
    "agentic_score": null,
    "vector": null
  },
  "poc": null,
  "timeline": null,
  "_meta": {
    "schema_version": "1.0.0",
    "generated_at": "2026-03-18T21:02:24Z",
    "generator": "NAIL Institute AVE Toolkit",
    "license": "CC-BY-SA-4.0",
    "access_tier": "public",
    "redacted_fields": [
      "avss_score",
      "defences",
      "evidence",
      "mechanism",
      "poc",
      "timeline"
    ],
    "full_access": "https://github.com/NAIL-INSTITUTE-FOR-AGENTIC-SECURITY/ave-database"
  },
  "contributor": "dleigh"
}