{
  "ave_id": "AVE-2025-0076",
  "name": "Configuration Drift Attack",
  "aliases": [
    "Silent Reconfig"
  ],
  "category": "environmental_manipulation",
  "severity": "high",
  "status": "proven",
  "summary": "Gradual modification of agent configuration files or environment variables to alter behaviour without triggering change detection.",
  "mechanism": "Sub-threshold changes to config values accumulate to produce significant behavioural shift. [Available in NAIL SDK]",
  "blast_radius": "Agent behaviour altered without detectable configuration change events.",
  "prerequisite": "Access to agent configuration storage.",
  "environment": {
    "frameworks": [
      "LangGraph"
    ],
    "models_tested": [
      "[Available in NAIL SDK]"
    ],
    "multi_agent": false,
    "tools_required": false,
    "memory_required": false
  },
  "evidence": [
    {
      "experiment_id": "[Available in NAIL SDK]",
      "key_metric": "[Available in NAIL SDK]",
      "key_value": "[Available in NAIL SDK]",
      "data_file": "",
      "p_value": null,
      "sample_size": null,
      "cross_model": false
    }
  ],
  "defences": [],
  "date_discovered": "2026-03",
  "date_published": "",
  "cwe_mapping": "",
  "mitre_mapping": "ATLAS-NOVEL: Configuration Drift Attack",
  "references": [],
  "related_aves": [
    "AVE-2025-0016"
  ],
  "avss_score": {
    "overall_score": 7.9,
    "severity_label": "high",
    "vector_string": "[Available in NAIL SDK]",
    "base_score": null,
    "temporal_score": null,
    "agentic_score": null,
    "vector": null
  },
  "poc": null,
  "timeline": null,
  "_meta": {
    "schema_version": "2.0.0",
    "generated_at": "2026-03-27T22:41:24Z",
    "generator": "NAIL Institute AVE Toolkit",
    "license": "CC-BY-SA-4.0",
    "access_tier": "public",
    "redacted_fields": [
      "avss_score",
      "defences",
      "evidence",
      "mechanism",
      "poc",
      "timeline"
    ],
    "full_access": "https://github.com/NAIL-INSTITUTE-FOR-AGENTIC-SECURITY/ave-database"
  },
  "contributor": "j.okafor"
}