{
  "ave_id": "AVE-2025-0063",
  "name": "Social Engineering Relay",
  "aliases": [
    "Human-Agent-Human Chain"
  ],
  "category": "composite",
  "severity": "high",
  "status": "proven",
  "summary": "Attacker social-engineers a human user to provide information to an agent, which the agent then uses to compromise another human.",
  "mechanism": "The agent becomes an unwitting relay in a cross-domain social engineering attack. [Available in NAIL SDK]",
  "blast_radius": "Human victims on both sides of the agent.",
  "prerequisite": "Agent interfacing with multiple human users.",
  "environment": {
    "frameworks": [
      "LangGraph",
      "CrewAI"
    ],
    "models_tested": [
      "[Available in NAIL SDK]"
    ],
    "multi_agent": false,
    "tools_required": false,
    "memory_required": false
  },
  "evidence": [
    {
      "experiment_id": "[Available in NAIL SDK]",
      "key_metric": "[Available in NAIL SDK]",
      "key_value": "[Available in NAIL SDK]",
      "data_file": "",
      "p_value": null,
      "sample_size": null,
      "cross_model": false
    }
  ],
  "defences": [],
  "date_discovered": "2026-03",
  "date_published": "",
  "cwe_mapping": "",
  "mitre_mapping": "ATLAS-NOVEL: Social Engineering Relay",
  "references": [],
  "related_aves": [
    "AVE-2025-0029"
  ],
  "avss_score": {
    "overall_score": 7.4,
    "severity_label": "high",
    "vector_string": "[Available in NAIL SDK]",
    "base_score": null,
    "temporal_score": null,
    "agentic_score": null,
    "vector": null
  },
  "poc": null,
  "timeline": null,
  "_meta": {
    "schema_version": "2.0.0",
    "generated_at": "2026-03-27T22:41:24Z",
    "generator": "NAIL Institute AVE Toolkit",
    "license": "CC-BY-SA-4.0",
    "access_tier": "public",
    "redacted_fields": [
      "avss_score",
      "defences",
      "evidence",
      "mechanism",
      "poc",
      "timeline"
    ],
    "full_access": "https://github.com/NAIL-INSTITUTE-FOR-AGENTIC-SECURITY/ave-database"
  },
  "contributor": "j.okafor"
}