{
  "ave_id": "AVE-2025-0066",
  "name": "System Prompt Extraction via Tool Logging",
  "aliases": [
    "Prompt Theft"
  ],
  "category": "model_extraction",
  "severity": "high",
  "status": "proven",
  "summary": "Agent's system prompt is leaked through verbose tool error messages or debug logging.",
  "mechanism": "Crafted tool failures cause the agent to include system prompt fragments in error responses. [Available in NAIL SDK]",
  "blast_radius": "Full system prompt disclosure enables targeted attacks.",
  "prerequisite": "Agent with tools that produce verbose errors.",
  "environment": {
    "frameworks": [
      "LangGraph",
      "CrewAI"
    ],
    "models_tested": [
      "[Available in NAIL SDK]"
    ],
    "multi_agent": false,
    "tools_required": true,
    "memory_required": false
  },
  "evidence": [
    {
      "experiment_id": "[Available in NAIL SDK]",
      "key_metric": "[Available in NAIL SDK]",
      "key_value": "[Available in NAIL SDK]",
      "data_file": "",
      "p_value": null,
      "sample_size": null,
      "cross_model": false
    }
  ],
  "defences": [],
  "date_discovered": "2026-03",
  "date_published": "",
  "cwe_mapping": "",
  "mitre_mapping": "ATLAS-NOVEL: System Prompt Extraction via Tool Logging",
  "references": [],
  "related_aves": [
    "AVE-2025-0003"
  ],
  "avss_score": {
    "overall_score": 7.6,
    "severity_label": "high",
    "vector_string": "[Available in NAIL SDK]",
    "base_score": null,
    "temporal_score": null,
    "agentic_score": null,
    "vector": null
  },
  "poc": null,
  "timeline": null,
  "_meta": {
    "schema_version": "2.0.0",
    "generated_at": "2026-03-27T22:41:24Z",
    "generator": "NAIL Institute AVE Toolkit",
    "license": "CC-BY-SA-4.0",
    "access_tier": "public",
    "redacted_fields": [
      "avss_score",
      "defences",
      "evidence",
      "mechanism",
      "poc",
      "timeline"
    ],
    "full_access": "https://github.com/NAIL-INSTITUTE-FOR-AGENTIC-SECURITY/ave-database"
  },
  "contributor": "m.torres"
}