{
  "ave_id": "AVE-2025-0088",
  "name": "Cross-User Memory Leakage",
  "aliases": [
    "Memory Bleed"
  ],
  "category": "memory",
  "severity": "critical",
  "status": "proven",
  "summary": "Agent's memory isolation between users fails, allowing one user's data to leak into another user's context.",
  "mechanism": "Shared vector store with insufficient tenant isolation. [Available in NAIL SDK]",
  "blast_radius": "Cross-user data exposure in multi-tenant deployments.",
  "prerequisite": "Multi-tenant agent with shared memory infrastructure.",
  "environment": {
    "frameworks": [
      "LangGraph"
    ],
    "models_tested": [
      "[Available in NAIL SDK]"
    ],
    "multi_agent": false,
    "tools_required": false,
    "memory_required": true
  },
  "evidence": [
    {
      "experiment_id": "[Available in NAIL SDK]",
      "key_metric": "[Available in NAIL SDK]",
      "key_value": "[Available in NAIL SDK]",
      "data_file": "",
      "p_value": null,
      "sample_size": null,
      "cross_model": false
    }
  ],
  "defences": [],
  "date_discovered": "2026-03",
  "date_published": "",
  "cwe_mapping": "",
  "mitre_mapping": "ATLAS-NOVEL: Cross-User Memory Leakage",
  "references": [],
  "related_aves": [
    "AVE-2025-0009"
  ],
  "avss_score": {
    "overall_score": 9.5,
    "severity_label": "critical",
    "vector_string": "[Available in NAIL SDK]",
    "base_score": null,
    "temporal_score": null,
    "agentic_score": null,
    "vector": null
  },
  "poc": null,
  "timeline": null,
  "_meta": {
    "schema_version": "2.0.0",
    "generated_at": "2026-03-27T22:41:24Z",
    "generator": "NAIL Institute AVE Toolkit",
    "license": "CC-BY-SA-4.0",
    "access_tier": "public",
    "redacted_fields": [
      "avss_score",
      "defences",
      "evidence",
      "mechanism",
      "poc",
      "timeline"
    ],
    "full_access": "https://github.com/NAIL-INSTITUTE-FOR-AGENTIC-SECURITY/ave-database"
  },
  "contributor": "dleigh"
}