{
  "ave_id": "AVE-2025-0003",
  "name": "Token Embezzlement (EDoS)",
  "aliases": [
    "Economic Denial of Service",
    "Recursive Token Drain"
  ],
  "category": "resource",
  "severity": "critical",
  "status": "proven_mitigated",
  "summary": "Attacker tricks an agent into exponential token consumption via recursive loops, inflating costs 3\u201312\u00d7 within 5 rounds.",
  "mechanism": "Crafted prompts trigger self-referential reasoning loops, tool-call chains that expand, or verbose output modes that compound across multi-agent passes.. [Available in NAIL SDK]",
  "blast_radius": "3\u201312\u00d7 budget overrun. Potential unbounded cost in production.",
  "prerequisite": "Agent with token budget and iterative/recursive capability.",
  "environment": {
    "frameworks": [
      "LangGraph"
    ],
    "models_tested": [
      "[Available in NAIL SDK]"
    ],
    "multi_agent": false,
    "tools_required": false,
    "memory_required": false
  },
  "evidence": [
    {
      "experiment_id": "[Available in NAIL SDK]",
      "key_metric": "budget_overrun",
      "key_value": "[Available in NAIL SDK]",
      "data_file": "",
      "p_value": null,
      "sample_size": null,
      "cross_model": false
    }
  ],
  "defences": [
    {
      "name": "Token Kinetics Monitor (L4)",
      "layer": "",
      "effectiveness": "[Available in NAIL SDK]",
      "rmap_module": "",
      "nail_monitor_detector": ""
    }
  ],
  "date_discovered": "2025-01",
  "date_published": "",
  "cwe_mapping": "",
  "mitre_mapping": "",
  "references": [],
  "related_aves": [
    "AVE-2025-0035",
    "AVE-2025-0011",
    "AVE-2025-0020"
  ],
  "avss_score": {
    "overall_score": 8.2,
    "severity_label": "high",
    "vector_string": "[Available in NAIL SDK]",
    "base_score": null,
    "temporal_score": null,
    "agentic_score": null,
    "vector": null
  },
  "poc": null,
  "timeline": null,
  "_meta": {
    "schema_version": "1.0.0",
    "generated_at": "2026-03-18T21:02:24Z",
    "generator": "NAIL Institute AVE Toolkit",
    "license": "CC-BY-SA-4.0",
    "access_tier": "public",
    "redacted_fields": [
      "avss_score",
      "defences",
      "evidence",
      "mechanism",
      "poc",
      "timeline"
    ],
    "full_access": "https://github.com/NAIL-INSTITUTE-FOR-AGENTIC-SECURITY/ave-database"
  },
  "contributor": "m.torres"
}