{
  "ave_id": "AVE-2025-0056",
  "name": "Context Window Exhaustion Attack",
  "aliases": [
    "Prompt Crowding"
  ],
  "category": "temporal_exploitation",
  "severity": "high",
  "status": "proven",
  "summary": "Attacker floods agent's context window with benign content, pushing system instructions out of effective attention range.",
  "mechanism": "Long-context saturation causes system prompt degradation. [Available in NAIL SDK]",
  "blast_radius": "Safety instructions become ineffective.",
  "prerequisite": "Agent with limited context window and no context management.",
  "environment": {
    "frameworks": [
      "LangGraph"
    ],
    "models_tested": [
      "[Available in NAIL SDK]"
    ],
    "multi_agent": false,
    "tools_required": false,
    "memory_required": false
  },
  "evidence": [
    {
      "experiment_id": "[Available in NAIL SDK]",
      "key_metric": "[Available in NAIL SDK]",
      "key_value": "[Available in NAIL SDK]",
      "data_file": "",
      "p_value": null,
      "sample_size": null,
      "cross_model": false
    }
  ],
  "defences": [],
  "date_discovered": "2026-03",
  "date_published": "",
  "cwe_mapping": "",
  "mitre_mapping": "ATLAS-NOVEL: Context Window Exhaustion Attack",
  "references": [],
  "related_aves": [
    "AVE-2025-0050"
  ],
  "avss_score": {
    "overall_score": 7.8,
    "severity_label": "high",
    "vector_string": "[Available in NAIL SDK]",
    "base_score": null,
    "temporal_score": null,
    "agentic_score": null,
    "vector": null
  },
  "poc": null,
  "timeline": null,
  "_meta": {
    "schema_version": "2.0.0",
    "generated_at": "2026-03-27T22:41:24Z",
    "generator": "NAIL Institute AVE Toolkit",
    "license": "CC-BY-SA-4.0",
    "access_tier": "public",
    "redacted_fields": [
      "avss_score",
      "defences",
      "evidence",
      "mechanism",
      "poc",
      "timeline"
    ],
    "full_access": "https://github.com/NAIL-INSTITUTE-FOR-AGENTIC-SECURITY/ave-database"
  },
  "contributor": "priya.r"
}